{
  "authority": {
    "can_execute": false,
    "can_recommend": false,
    "financial_authority": "none",
    "is_credit_rating": false
  },
  "canonicalization": "liquilens-hash-tree-v1",
  "carrier_id": "evidence_d95d3776895ef19a975bd78f",
  "claim": {
    "kind": "fleet_brief_conformance",
    "status": "structural",
    "summary": "Independent seiche conformance evidence"
  },
  "clocks": {
    "as_of": "2026-08-24T11:26:46Z",
    "event_time": "2026-08-24T11:26:45Z",
    "expires_at": "2030-01-01T00:00:00Z",
    "knowledge_time": "2026-08-24T11:26:45Z"
  },
  "extensions": {},
  "payload": {
    "aggregation_permitted": false,
    "native_product": "seiche"
  },
  "producer": {
    "endpoint": "https://api.seiche.info/v2/world-markets",
    "name": "seiche",
    "version": "0.15.0-conformance"
  },
  "record_hash": "d95d3776895ef19a975bd78f6901c025040d6085788a023adf8ea58a28ad68a7",
  "rights": {
    "attribution": "LiquiLens Evidence Carrier contributors",
    "jurisdictions": [
      "global"
    ],
    "license": "Apache-2.0",
    "license_url": "https://github.com/beepboop2025/liquilens-evidence-carrier/blob/main/LICENSE",
    "permissions": [
      "ingest",
      "derive",
      "display",
      "redistribute"
    ],
    "status": "metadata_only"
  },
  "schema_version": "1.0",
  "sources": [
    {
      "content_sha256": "7f8494d8470853dc88665ea32c1dccb40cc58c55b07e9267aa28c81f83c1ccd3",
      "publisher": "seiche conformance fixture",
      "retrieved_at": "2026-08-24T11:26:45Z",
      "source_id": "seiche:fleet-brief:v1",
      "title": "LiquiLens Evidence Carrier v1 JSON Schema",
      "url": "https://liquilens.in/protocol/liquilens-evidence-carrier-v1.schema.json"
    }
  ],
  "subject": {
    "identifiers": {
      "fixture": "seiche-fleet-brief-v1"
    },
    "kind": "protocol_artifact",
    "name": "seiche native conformance evidence"
  }
}
